{
  "$id": "https://qra.local/contracts/part1/v1/qra-input.schema.json",
  "$schema": "https://json-schema.org/draft/2020-12/schema",
  "additionalProperties": false,
  "properties": {
    "assessment": {
      "type": "object"
    },
    "damage_model": {
      "type": "object"
    },
    "data_category_manifest": {
      "type": "object"
    },
    "engineering_indicators": {
      "type": "object"
    },
    "expected_aggregation": {
      "type": "object"
    },
    "extensions": {
      "type": "object"
    },
    "frequency_correction_model": {
      "type": "object"
    },
    "frequency_library": {
      "type": "object"
    },
    "ignition_model": {
      "type": "object"
    },
    "metadata": {
      "additionalProperties": false,
      "anyOf": [
        {
          "required": [
            "case_id"
          ]
        },
        {
          "required": [
            "project_name"
          ]
        }
      ],
      "properties": {
        "allowed_use": {
          "type": [
            "string",
            "number",
            "integer",
            "boolean",
            "object",
            "array",
            "null"
          ]
        },
        "case_id": {
          "type": [
            "string",
            "number",
            "integer",
            "boolean",
            "object",
            "array",
            "null"
          ]
        },
        "conversion_scope": {
          "type": [
            "string",
            "number",
            "integer",
            "boolean",
            "object",
            "array",
            "null"
          ]
        },
        "converter_note": {
          "type": [
            "string",
            "number",
            "integer",
            "boolean",
            "object",
            "array",
            "null"
          ]
        },
        "created_at": {
          "type": [
            "string",
            "number",
            "integer",
            "boolean",
            "object",
            "array",
            "null"
          ]
        },
        "data_classification": {
          "type": [
            "string",
            "number",
            "integer",
            "boolean",
            "object",
            "array",
            "null"
          ]
        },
        "explicit_data_gaps": {
          "type": [
            "string",
            "number",
            "integer",
            "boolean",
            "object",
            "array",
            "null"
          ]
        },
        "formal_qra_allowed": {
          "type": [
            "string",
            "number",
            "integer",
            "boolean",
            "object",
            "array",
            "null"
          ]
        },
        "model_id": {
          "type": [
            "string",
            "number",
            "integer",
            "boolean",
            "object",
            "array",
            "null"
          ]
        },
        "name": {
          "type": [
            "string",
            "number",
            "integer",
            "boolean",
            "object",
            "array",
            "null"
          ]
        },
        "prohibited_use": {
          "type": [
            "string",
            "number",
            "integer",
            "boolean",
            "object",
            "array",
            "null"
          ]
        },
        "project_name": {
          "type": [
            "string",
            "number",
            "integer",
            "boolean",
            "object",
            "array",
            "null"
          ]
        },
        "run_profile": {
          "type": [
            "string",
            "number",
            "integer",
            "boolean",
            "object",
            "array",
            "null"
          ]
        },
        "version": {
          "type": [
            "string",
            "number",
            "integer",
            "boolean",
            "object",
            "array",
            "null"
          ]
        },
        "warning": {
          "type": [
            "string",
            "number",
            "integer",
            "boolean",
            "object",
            "array",
            "null"
          ]
        }
      },
      "type": "object"
    },
    "mock_adapter_output": {
      "type": "object"
    },
    "pipeline": {
      "additionalProperties": false,
      "properties": {
        "design_pressure_mpa": {
          "type": [
            "string",
            "number",
            "integer",
            "boolean",
            "object",
            "array",
            "null"
          ]
        },
        "gas_composition_mole_fraction": {
          "type": [
            "string",
            "number",
            "integer",
            "boolean",
            "object",
            "array",
            "null"
          ]
        },
        "installation": {
          "type": [
            "string",
            "number",
            "integer",
            "boolean",
            "object",
            "array",
            "null"
          ]
        },
        "material": {
          "type": [
            "string",
            "number",
            "integer",
            "boolean",
            "object",
            "array",
            "null"
          ]
        },
        "operating_pressure_data_status": {
          "type": [
            "string",
            "number",
            "integer",
            "boolean",
            "object",
            "array",
            "null"
          ]
        },
        "operating_pressure_mpa": {
          "type": [
            "string",
            "number",
            "integer",
            "boolean",
            "object",
            "array",
            "null"
          ]
        },
        "operating_temperature_data_status": {
          "type": [
            "string",
            "number",
            "integer",
            "boolean",
            "object",
            "array",
            "null"
          ]
        },
        "operating_temperature_k": {
          "type": [
            "string",
            "number",
            "integer",
            "boolean",
            "object",
            "array",
            "null"
          ]
        },
        "outside_diameter_mm": {
          "type": [
            "string",
            "number",
            "integer",
            "boolean",
            "object",
            "array",
            "null"
          ]
        },
        "pipeline_id": {
          "type": [
            "string",
            "number",
            "integer",
            "boolean",
            "object",
            "array",
            "null"
          ]
        },
        "population_spatial_data_status": {
          "type": [
            "string",
            "number",
            "integer",
            "boolean",
            "object",
            "array",
            "null"
          ]
        },
        "service": {
          "type": [
            "string",
            "number",
            "integer",
            "boolean",
            "object",
            "array",
            "null"
          ]
        },
        "source_refs": {
          "type": [
            "string",
            "number",
            "integer",
            "boolean",
            "object",
            "array",
            "null"
          ]
        },
        "total_length_km": {
          "type": [
            "string",
            "number",
            "integer",
            "boolean",
            "object",
            "array",
            "null"
          ]
        },
        "wall_thickness_data_status": {
          "type": [
            "string",
            "number",
            "integer",
            "boolean",
            "object",
            "array",
            "null"
          ]
        },
        "wall_thickness_mm": {
          "type": [
            "string",
            "number",
            "integer",
            "boolean",
            "object",
            "array",
            "null"
          ]
        }
      },
      "type": "object"
    },
    "population_cells": {
      "items": {
        "type": "object"
      },
      "type": "array"
    },
    "raw_data_categories": {
      "type": "object"
    },
    "risk_matrix_criteria": {
      "type": "object"
    },
    "schema_version": {
      "type": "string"
    },
    "segment_correction_factor": {
      "type": "object"
    },
    "segments": {
      "items": {
        "additionalProperties": false,
        "properties": {
          "area_activity": {
            "type": [
              "string",
              "number",
              "integer",
              "boolean",
              "object",
              "array",
              "null"
            ]
          },
          "burial_depth_m": {
            "type": [
              "string",
              "number",
              "integer",
              "boolean",
              "object",
              "array",
              "null"
            ]
          },
          "commissioning_year": {
            "type": [
              "string",
              "number",
              "integer",
              "boolean",
              "object",
              "array",
              "null"
            ]
          },
          "downstream_valve_km": {
            "type": [
              "string",
              "number",
              "integer",
              "boolean",
              "object",
              "array",
              "null"
            ]
          },
          "end_km": {
            "exclusiveMinimum": 0,
            "type": "number"
          },
          "end_xy_m": {
            "items": false,
            "minItems": 2,
            "prefixItems": [
              {
                "type": "number"
              },
              {
                "type": "number"
              }
            ],
            "type": "array"
          },
          "leak_detection_time_s": {
            "type": [
              "string",
              "number",
              "integer",
              "boolean",
              "object",
              "array",
              "null"
            ]
          },
          "length_km": {
            "exclusiveMinimum": 0,
            "type": "number"
          },
          "material_grade": {
            "type": [
              "string",
              "number",
              "integer",
              "boolean",
              "object",
              "array",
              "null"
            ]
          },
          "outside_diameter_mm": {
            "type": [
              "string",
              "number",
              "integer",
              "boolean",
              "object",
              "array",
              "null"
            ]
          },
          "population_context": {
            "type": [
              "string",
              "number",
              "integer",
              "boolean",
              "object",
              "array",
              "null"
            ]
          },
          "quality": {
            "type": [
              "string",
              "number",
              "integer",
              "boolean",
              "object",
              "array",
              "null"
            ]
          },
          "review_status": {
            "type": [
              "string",
              "number",
              "integer",
              "boolean",
              "object",
              "array",
              "null"
            ]
          },
          "segment_id": {
            "minLength": 1,
            "type": "string"
          },
          "source_ref": {
            "type": [
              "string",
              "number",
              "integer",
              "boolean",
              "object",
              "array",
              "null"
            ]
          },
          "source_refs": {
            "type": [
              "string",
              "number",
              "integer",
              "boolean",
              "object",
              "array",
              "null"
            ]
          },
          "split_reason": {
            "type": [
              "string",
              "number",
              "integer",
              "boolean",
              "object",
              "array",
              "null"
            ]
          },
          "start_km": {
            "minimum": 0,
            "type": "number"
          },
          "start_xy_m": {
            "items": false,
            "minItems": 2,
            "prefixItems": [
              {
                "type": "number"
              },
              {
                "type": "number"
              }
            ],
            "type": "array"
          },
          "steel_grade": {
            "type": [
              "string",
              "number",
              "integer",
              "boolean",
              "object",
              "array",
              "null"
            ]
          },
          "upstream_valve_km": {
            "type": [
              "string",
              "number",
              "integer",
              "boolean",
              "object",
              "array",
              "null"
            ]
          },
          "valve_closure_time_s": {
            "type": [
              "string",
              "number",
              "integer",
              "boolean",
              "object",
              "array",
              "null"
            ]
          },
          "wall_thickness_mm": {
            "type": [
              "string",
              "number",
              "integer",
              "boolean",
              "object",
              "array",
              "null"
            ]
          }
        },
        "required": [
          "segment_id",
          "start_km",
          "end_km",
          "length_km"
        ],
        "type": "object"
      },
      "minItems": 1,
      "type": "array"
    },
    "standard_formula_test_parameters": {
      "type": "object"
    },
    "system_parameters": {
      "type": "object"
    },
    "validation_expectations": {
      "type": "object"
    },
    "weather_joint_probability": {
      "items": {
        "type": "object"
      },
      "type": "array"
    }
  },
  "required": [
    "metadata",
    "pipeline",
    "segments"
  ],
  "title": "QRA Part 1 input snapshot",
  "type": "object"
}
